{
  "id": "ref-microsoft-pyrit",
  "name": "Microsoft PyRIT",
  "description": "Open-source framework for security risk identification and red teaming in generative AI systems.",
  "version": "1.0.0",
  "status": "active",
  "tags": ["pyrit", "red_teaming", "risk_identification"],
  "source_type": "repository",
  "authors": ["Microsoft"],
  "published_at": "2024",
  "url": "https://github.com/Azure/PyRIT",
  "citation": "Microsoft PyRIT, Python Risk Identification Toolkit.",
  "relevance": "Informs modular red teaming design, reusable objectives, scorers, converters, memory, and target abstractions.",
  "references": [],
  "created_at": "2026-07-08",
  "updated_at": "2026-07-08"
}
