{
  "id": "ref-agentdojo",
  "name": "AgentDojo",
  "description": "Benchmark for evaluating prompt injection and task utility tradeoffs in tool-using LLM agents.",
  "version": "1.0.0",
  "status": "active",
  "tags": ["agent_security", "benchmark", "tool_use"],
  "source_type": "paper",
  "authors": ["OWASP-linked research community"],
  "published_at": "2024",
  "url": "https://arxiv.org/abs/2406.13352",
  "citation": "AgentDojo: A Dynamic Environment to Evaluate Attacks and Defenses for LLM Agents, 2024.",
  "relevance": "Supports reasoning about utility under attack, tool-call safety, and indirect prompt injection in agent workflows.",
  "references": [],
  "created_at": "2026-07-08",
  "updated_at": "2026-07-08"
}
